ID,Gen,Name,Type,AC (MD),AC,PW,PP,PR,Charge,Recoil,Power,Resist,Description,Old Description,Target,Alt Name,Contest Type,Effect Chance,Effect ID
175,2,Flame Wheel,Fire,100,100,60,25,0,,,Attack,Defense,The user cloaks itself in fire and charges at the target. This may also leave the target with a burn.,The user cloaks itself in fire and charges at the target. This may also leave the target with a burn.,"One other Pokémon on the field, selected by the trainer.",Flame Wheel,Beauty,10,126
176,2,Snore,Normal,100,100,50,15,0,,,S. Attack,S. Defense,An attack that can be used only if the user is asleep. The harsh noise may also make the target flinch.,This attack can be used only if the user is asleep. The harsh noise may also make the target flinch.,"One other Pokémon on the field, selected by the trainer.",Snore,Cute,30,93
177,2,Curse,Ghost,-1,,,10,0,,,None,None,A move that works differently for the Ghost type than for all other types...,A move that works differently for the Ghost type than for all other types.,One specific move.  How this move is chosen depends upon on the move being used.,Curse,Tough,,110
178,2,Flail,Normal,100,100,,15,0,,,Attack,Defense,"The user flails about aimlessly to attack. The less HP the user has, the greater the move's power.",The user flails about aimlessly to attack. The less HP the user has the greater the move’s power.,"One other Pokémon on the field, selected by the trainer.",Flail,Cute,,100
179,2,Conversion 2,Normal,-1,,,30,0,,,None,None,"The user gives itself the Conversion 2 status, which changes its type to resist the opponent's moves.",The user changes its type to make itself resistant to the type of the attack the opponent used last.,"One other Pokémon on the field, selected by the trainer.",Conversion 2,Beauty,,94
180,2,Aeroblast,Flying,90,95,100,5,0,,,S. Attack,S. Defense,A vortex of air is shot at the target to inflict damage. Critical hits land 1 stage more easily.,A vortex of air is shot at the target to inflict damage. Critical hits land more easily.,"One other Pokémon on the field, selected by the trainer.",Aeroblast,Cool,,44
181,2,Cotton Spore,Grass,85,100,,40,0,,,None,None,"The user releases cotton-like spores that cling to the opposing Pokémon, which lowers their Movement Speeds.",The user releases cotton-like spores that cling to the opposing Pokémon which harshly lowers their Speed stat.,All opposing Pokémon.,Cotton Spore,Beauty,,61
182,2,Reversal,Fighting,100,100,,15,0,,,Attack,Defense,An all-out attack that becomes more powerful the less HP the user has.,An all-out attack that becomes more powerful the less HP the user has.,"One other Pokémon on the field, selected by the trainer.",Reversal,Cool,,100
183,2,Spite,Ghost,100,100,,10,0,,,None,None,"The user unleashes its grudge on the move last used by the target, reducing its PP to 0.",The user unleashes its grudge on the move last used by the target by cutting 4 PP from it.,"One other Pokémon on the field, selected by the trainer.",Spite,Tough,,101
184,2,Powder Snow,Ice,100,100,40,25,0,,,S. Attack,S. Defense,The user attacks with a chilling gust of powdery snow. This may also freeze the opposing Pokémon.,The user attacks with a chilling gust of powdery snow. This may also freeze the opposing Pokémon.,All opposing Pokémon.,Powder Snow,Beauty,10,6
185,2,Protect,Normal,-1,,,10,4,,,None,None,It enables the user to evade all attacks.,Enables the user to evade all attacks. Its chance of failing rises if it is used in succession.,The user.,Protect,Cute,,112
186,2,Mach Punch,Fighting,100,100,40,30,1,,,Attack,Defense,The user throws a punch at blinding speed.,The user throws a punch at blinding speed. This move always goes first.,"One other Pokémon on the field, selected by the trainer.",Mach Punch,Cool,,104
187,2,Scary Face,Normal,70,100,,10,0,,,None,None,The user frightens the target with a scary face to harshly lower its Movement Speed.,The user frightens the target with a scary face to harshly lower its Speed stat.,"One other Pokémon on the field, selected by the trainer.",Scary Face,Tough,,61
188,2,Feint Attack,Dark,-1,,60,20,0,,,Attack,Defense,"The user approaches the target disarmingly, then throws a sucker punch. This attack never misses.",The user approaches the target disarmingly then throws a sucker punch. This attack never misses.,"One other Pokémon on the field, selected by the trainer.",Feint Attack,Smart,,18
189,2,Sweet Kiss,Fairy,100,75,,10,0,,,None,None,"The user kisses the target with a sweet, angelic cuteness that causes confusion.",The user kisses the target with a sweet angelic cuteness that causes confusion.,"One other Pokémon on the field, selected by the trainer.",Sweet Kiss,Cute,,50
190,2,Belly Drum,Normal,-1,,,10,0,,,None,None,The user maximizes its Attack stat in exchange for half its max HP.,The user maximizes its Attack stat in exchange for HP equal to half its max HP.,The user.,Belly Drum,Cute,,143
191,2,Sludge Bomb,Poison,100,100,90,10,0,,,S. Attack,S. Defense,Unsanitary sludge is hurled at the target. This may also poison the target.,Unsanitary sludge is hurled at the target. This may also poison the target.,"One other Pokémon on the field, selected by the trainer.",Sludge Bomb,Tough,30,3
192,2,Mud Slap,Ground,100,100,20,10,0,,,S. Attack,S. Defense,The user hurls mud in the target's face to inflict damage and lower its Accuracy.,The user hurls mud in the target’s face to inflict damage and lower its accuracy.,"One other Pokémon on the field, selected by the trainer.",Mud-Slap,Cute,100,74
193,2,Octazooka,Water,90,85,65,10,0,,,S. Attack,S. Defense,The user attacks by spraying ink at the target's face or eyes. This has a 50% chance to lower the target's Accuracy.,The user attacks by spraying ink in the target’s face or eyes. This may also lower the target’s accuracy.,"One other Pokémon on the field, selected by the trainer.",Octazooka,Tough,50,74
194,2,Spikes,Ground,-1,,,20,0,,,None,None,The user lays a down trap of spikes in front of itself. The trap hurts Pokémon that step on it.,The user lays a trap of spikes at the opposing team’s feet. The trap hurts Pokémon that switch into battle.,The opposing side of the field.  Affects opposing Pokémon.,Spikes,Smart,,113
195,2,Zap Cannon,Electric,50,50,120,5,0,,,S. Attack,S. Defense,The user fires an electric blast like a cannon to inflict damage and cause paralysis.,The user fires an electric blast like a cannon to inflict damage and cause paralysis.,"One other Pokémon on the field, selected by the trainer.",Zap Cannon,Cool,100,7
196,2,Foresight,Normal,-1,,,40,0,,,None,None,"The user identifies the target, removing its resistances and immunities. This also enables an evasive target to be hit.",Enables a Ghost-type target to be hit by Normal- and Fighting-type attacks. This also enables an evasive target to be hit.,"One other Pokémon on the field, selected by the trainer.",Foresight,Smart,,114
197,2,Destiny Bond,Ghost,-1,,,5,0,,,None,None,"If the user faints in the same turn, the Pokémon that landed the knockout hit also faints. Its chance of failing rises if it is used in succession.","If the user faints in the same turn, the Pokémon that landed the knockout hit also faints. Its chance of failing rises if it is used in succession.",The user.,Destiny Bond,Smart,,99
198,2,Perish Song,Normal,-1,,,5,0,,,None,None,Any Pokémon that hears this song will faint when its countdown reaches 0.,Any Pokémon that hears this song faints in three turns unless it switches out of battle.,Every Pokémon on the field.,Perish Song,Beauty,,115
199,2,Icy Wind,Ice,90,95,55,15,0,,,S. Attack,S. Defense,The user attacks with a gust of chilled air. This also lowers the opposing Pokémon's Movement Speed.,The user attacks with a gust of chilled air. This also lowers the opposing Pokémon’s Speed stats.,All opposing Pokémon.,Icy Wind,Beauty,100,71
200,2,Detect,Fighting,-1,,,5,4,,,None,None,It enables the user to evade all attacks.,Enables the user to evade all attacks. Its chance of failing rises if it is used in succession.,The user.,Detect,Cool,,112
201,2,Bone Rush,Ground,50,90,25,10,0,,,Attack,Defense,The user strikes the target with a hard bone two to five times in a row.,The user strikes the target with a hard bone two to five times in a row.,"One other Pokémon on the field, selected by the trainer.",Bone Rush,Tough,,30
202,2,Lock On,Normal,-1,,,5,0,,,None,None,"The user takes aim, and ensures the next attack does not miss the target.",The user takes sure aim at the target. This ensures the next attack does not miss the target.,"One other Pokémon on the field, selected by the trainer.",Lock-On,Smart,,95
203,2,Outrage,Dragon,100,100,120,10,0,,,Attack,Defense,"The user rampages and attacks for three turns. It then becomes confused, however.",The user rampages and attacks for two to three turns. The user then becomes confused.,"One opposing Pokémon, selected at random.",Outrage,Cool,,28
204,2,Sandstorm,Rock,-1,,,10,0,,,None,None,"A sandstorm is summoned to hurt all combatants except the Rock, Ground, and Steel types.",A five-turn sandstorm is summoned to hurt all combatants except the Rock Ground and Steel types. It raises the Sp. Def stat of Rock types.,The entire field.  Affects all Pokémon.,Sandstorm,Tough,,116
205,2,Giga Drain,Grass,100,100,75,10,0,,,S. Attack,S. Defense,A nutrient-draining attack. The user's HP is restored by half the damage taken by the target.,A nutrient-draining attack. The user’s HP is restored by half the damage taken by the target.,"One other Pokémon on the field, selected by the trainer.",Giga Drain,Smart,,4
206,2,Endure,Normal,-1,,,10,4,,,None,None,The user endures any attack with at least 1 HP for 1 turn. Its chance of failing rises if it is used in succession.,The user endures any attack with at least 1 HP. Its chance of failing rises if it is used in succession.,The user.,Endure,Tough,,117
207,2,Charm,Fairy,80,100,,20,0,,,None,None,"The user gazes at the target rather charmingly, making it less wary. This harshly lowers its Attack stat.",The user gazes at the target rather charmingly making it less wary. This harshly lowers its Attack stat.,"One other Pokémon on the field, selected by the trainer.",Charm,Cute,,59
208,2,Rollout,Rock,90,90,30,20,0,,,Attack,Defense,The user rolls into the target from a distance. It becomes more powerful the farther the target is.,The user continually rolls into the target over five turns. It becomes more powerful each time it hits.,"One other Pokémon on the field, selected by the trainer.",Rollout,Tough,,118
209,2,False Swipe,Normal,100,100,40,40,0,,,Attack,Defense,A restrained attack that prevents the target from fainting. The target is left with at least 1 HP.,A restrained attack that prevents the target from fainting. The target is left with at least 1 HP.,"One other Pokémon on the field, selected by the trainer.",False Swipe,Cool,,102
210,2,Swagger,Normal,90,85,,15,0,,,None,None,"The user enrages and confuses the target. However, this also sharply raises the target's Attack stat.",The user enrages and confuses the target. However this also sharply raises the target’s Attack stat.,"One other Pokémon on the field, selected by the trainer.",Swagger,Cute,,119
211,2,Milk Drink,Normal,-1,,,10,0,,,None,None,The user restores the party's HP by up to a half of its max HP,The user restores its own HP by up to half of its max HP.,The user.,Milk Drink,Cute,,33
212,2,Spark,Electric,100,100,65,20,0,,,Attack,Defense,The user throws an electrically charged tackle at the target. This may also leave the target with paralysis.,The user throws an electrically charged tackle at the target. This may also leave the target with paralysis.,"One other Pokémon on the field, selected by the trainer.",Spark,Cool,30,7
213,2,Fury Cutter,Bug,90,95,40,20,0,,,Attack,Defense,The target is slashed with scythes or claws. This attack becomes more powerful if it hits in succession.,The target is slashed with scythes or claws. This attack becomes more powerful if it hits in succession.,"One other Pokémon on the field, selected by the trainer.",Fury Cutter,Cool,,120
214,2,Steel Wing,Steel,100,90,70,25,0,,,Attack,Defense,The target is hit with wings of steel. This may also raise the user's Defense stat.,The target is hit with wings of steel. This may also raise the user’s Defense stat.,"One other Pokémon on the field, selected by the trainer.",Steel Wing,Cool,10,139
215,2,Mean Look,Normal,100,,,5,0,,,None,None,"The user pins the target with a dark, arresting look. The target becomes immobilized.",The user pins the target with a dark arresting look. The target becomes unable to flee.,"One other Pokémon on the field, selected by the trainer.",Mean Look,Beauty,,107
216,2,Attract,Normal,100,100,,15,0,,,None,None,"If it is the opposite gender of the user, the target becomes infatuated and cannot hurt the user.",If it is the opposite gender of the user the target becomes infatuated and less likely to attack.,"One other Pokémon on the field, selected by the trainer.",Attract,Cute,,121
217,2,Sleep Talk,Normal,-1,,,10,0,,,None,None,"While it is asleep, the user performs a random move that it knows.",While it is asleep the user randomly uses one of the moves it knows.,The user.,Sleep Talk,Cute,,98
218,2,Heal Bell,Normal,-1,,,5,0,,,None,None,The user makes a soothing bell chime to heal the status conditions of all Pokémon.,The user makes a soothing bell chime to heal the status conditions of all the party Pokémon.,The user and its allies.,Heal Bell,Beauty,,103
219,2,Return,Normal,100,100,,20,0,,,Attack,Defense,A full-power attack that grows more powerful the more allies there are nearby.,This full-power attack grows more powerful the more the user likes its Trainer.,"One other Pokémon on the field, selected by the trainer.",Return,Cute,,122
220,2,Present,Normal,100,90,,15,0,,,Attack,Defense,The user attacks by giving the target a gift with a hidden trap. It restores HP if used on an ally.,The user attacks by giving the target a gift with a hidden trap. It restores HP sometimes however.,"One other Pokémon on the field, selected by the trainer.",Present,Cute,,123
221,2,Frustration,Normal,100,100,,20,0,,,Attack,Defense,"Uses Connection for damage calculation, but negatively.",This full-power attack grows more powerful the less the user likes its Trainer.,"One other Pokémon on the field, selected by the trainer.",Frustration,Cute,,124
222,2,Safeguard,Normal,-1,,,25,0,,,None,None,The user creates a protective field that prevents status conditions for ten turns.,The user creates a protective field that prevents status conditions for five turns.,The user's side of the field.  Affects the user and its ally (if any).,Safeguard,Beauty,,125
223,2,Pain Split,Normal,-1,,,20,0,,,None,None,"The user adds its HP to the target's HP, then equally shares the combined HP with the target.",The user adds its HP to the target’s HP then equally shares the combined HP with the target.,"One other Pokémon on the field, selected by the trainer.",Pain Split,Smart,,92
224,2,Sacred Fire,Fire,100,95,100,5,0,,,Attack,Defense,The target is razed with a mystical fire of great intensity. This has a 50% chance to leave the target with a burn.,The target is razed with a mystical fire of great intensity. This may also leave the target with a burn.,"One other Pokémon on the field, selected by the trainer.",Sacred Fire,Beauty,50,126
225,2,Magnitude,Ground,100,100,,30,0,,,Attack,Defense,The user attacks everything around it with a ground-shaking quake. It does less damage to targets far away.,The user attacks everything around it with a ground-shaking quake. Its power varies.,Every other Pokémon on the field.,Magnitude,Tough,,127
226,2,Dynamic Punch,Fighting,50,50,100,5,0,,,Attack,Defense,"The user punches the target with full, concentrated power. This confuses the target if it hits.",The user punches the target with full concentrated power. This confuses the target if it hits.,"One other Pokémon on the field, selected by the trainer.",Dynamic Punch,Cool,100,77
227,2,Megahorn,Bug,75,85,120,10,0,,,Attack,Defense,"Using its tough and impressive horn, the user rams into the target with no letup.",Using its tough and impressive horn the user rams into the target with no letup.,"One other Pokémon on the field, selected by the trainer.",Megahorn,Cool,,1
228,2,Dragon Breath,Dragon,100,100,60,20,0,,,S. Attack,S. Defense,The user exhales a mighty gust that inflicts damage. This has a 30% chance to leave the target with paralysis.,The user exhales a mighty gust that inflicts damage. This may also leave the target with paralysis.,"One other Pokémon on the field, selected by the trainer.",Dragon Breath,Cool,30,7
229,2,Baton Pass,Normal,-1,,,40,0,,,None,None,The user passes along its stat changes and minor status conditions to the target. It also switches positions with that target.,The user switches places with a party Pokémon in waiting and passes along any stat changes.,The user.,Baton Pass,Cute,,128
230,2,Encore,Normal,100,100,,5,0,,,None,None,The user compels the target to keep using only the move it last used for five turns.,The user compels the target to keep using the move it encored for three turns.,"One other Pokémon on the field, selected by the trainer.",Encore,Cute,,91
231,2,Pursuit,Dark,-1,100,40,20,0,,,Attack,Defense,"The user chases down the target, preventing it from getting away.",The power of this attack move is doubled if it’s used on a target that’s switching out of battle.,"One other Pokémon on the field, selected by the trainer.",Pursuit,Smart,,129
232,2,Rapid Spin,Normal,100,100,50,40,0,,,Attack,Defense,A spin attack that can eliminate moves such as Wrap or Leech Seed. It also destroys traps.,A spin attack that can also eliminate such moves as Bind Wrap Leech Seed and Spikes.,"One other Pokémon on the field, selected by the trainer.",Rapid Spin,Cool,100,130
233,2,Sweet Scent,Normal,-1,100,,20,0,,,None,None,A sweet scent that lowers the evasiveness of opposing Pokémon.,A sweet scent that harshly lowers opposing Pokémon’s evasiveness.,All opposing Pokémon.,Sweet Scent,Cute,,25
234,2,Iron Tail,Steel,75,75,100,15,0,,,Attack,Defense,The target is slammed with a steel-hard tail. This has a 30% chance to lower the target's Defense stat. It can break walls.,The target is slammed with a steel-hard tail. This may also lower the target’s Defense stat.,"One other Pokémon on the field, selected by the trainer.",Iron Tail,Cool,30,70
235,2,Metal Claw,Steel,100,95,50,35,0,,,Attack,Defense,The target is raked with steel claws. This may also raise the user's Attack stat. It can break walls.,The target is raked with steel claws. This may also raise the user’s Attack stat.,"One other Pokémon on the field, selected by the trainer.",Metal Claw,Cool,10,140
236,2,Vital Throw,Fighting,-1,,70,10,-1,,,Attack,Defense,The user attacks with a throw move that never misses.,The user attacks last. In return this throw move never misses.,"One other Pokémon on the field, selected by the trainer.",Vital Throw,Cool,,79
237,2,Morning Sun,Normal,-1,,,5,0,,,None,None,The user restores the party's HP. The amount of HP regained varies with the weather.,The user restores its own HP. The amount of HP regained varies with the weather.,The user.,Morning Sun,Beauty,,133
238,2,Synthesis,Grass,-1,,,5,0,,,None,None,The user restores its own HP. The amount of HP regained varies with the weather.,The user restores its own HP. The amount of HP regained varies with the weather.,The user.,Synthesis,Smart,,133
239,2,Moonlight,Fairy,-1,,,5,0,,,None,None,The user restores the party's HP. The amount of HP regained varies with the weather.,The user restores its own HP. The amount of HP regained varies with the weather.,The user.,Moonlight,Beauty,,133
240,2,Hidden Power,Normal,100,100,60,15,0,,,S. Attack,S. Defense,A unique attack that varies in type each time it is used.,A unique attack that varies in type depending on the Pokémon using it.,"One other Pokémon on the field, selected by the trainer.",Hidden Power,Smart,,136
241,2,Cross Chop,Fighting,80,80,100,5,0,,,Attack,Defense,The user delivers a double chop with its forearms crossed. Critical hits land more easily.,The user delivers a double chop with its forearms crossed. Critical hits land more easily.,"One other Pokémon on the field, selected by the trainer.",Cross Chop,Cool,,44
242,2,Twister,Dragon,100,100,40,20,0,,,S. Attack,S. Defense,The user whips up a vicious tornado to tear at the opposing Pokémon. This may also make them flinch.,The user whips up a vicious tornado to tear at the opposing Pokémon. This may also make them flinch.,All opposing Pokémon.,Twister,Cool,20,147
243,2,Rain Dance,Water,-1,,,5,0,,,None,None,"The user summons a heavy rain on the floor, powering up Water-type moves.",The user summons a heavy rain that falls for five turns powering up Water-type moves. It lowers the power of Fire-type moves.,The entire field.  Affects all Pokémon.,Rain Dance,Tough,,137
244,2,Sunny Day,Fire,-1,,,5,0,,,None,None,"The user intensifies the sunlight for the entire floor, powering up Fire-type moves.",The user intensifies the sun for five turns powering up Fire-type moves. It lowers the power of Water-type moves.,The entire field.  Affects all Pokémon.,Sunny Day,Beauty,,138
245,2,Crunch,Dark,100,100,80,15,0,,,Attack,Defense,The user crunches up the target with sharp fangs. This has a 20% chance to lower the target's Defense stat.,The user crunches up the target with sharp fangs. This may also lower the target’s Defense stat.,"One other Pokémon on the field, selected by the trainer.",Crunch,Tough,20,70
246,2,Mirror Coat,Psychic,-1,100,,20,-5,,,S. Attack,S. Defense,"A retaliation move that counters any special attack, inflicting double the damage taken.",A retaliation move that counters any special attack inflicting double the damage taken.,One specific move.  How this move is chosen depends upon on the move being used.,Mirror Coat,Beauty,,145
247,2,Psych Up,Normal,-1,,,10,0,,,None,None,The user hypnotizes itself into copying any stat change made by the target.,The user hypnotizes itself into copying any stat change made by the target.,"One other Pokémon on the field, selected by the trainer.",Psych Up,Smart,,144
248,2,Extreme Speed,Normal,100,100,80,5,2,,,Attack,Defense,The user charges the target at blinding speed.,The user charges the target at blinding speed. This move always goes first.,"One other Pokémon on the field, selected by the trainer.",Extreme Speed,Cool,,104
249,2,Ancient Power,Rock,100,100,60,5,0,,,S. Attack,S. Defense,The user attacks with a prehistoric power. It may also raise all the user's stats at once.,The user attacks with a prehistoric power. This may also raise all the user’s stats at once.,"One other Pokémon on the field, selected by the trainer.",Ancient Power,Tough,10,141
250,2,Shadow Ball,Ghost,100,100,80,15,0,,,S. Attack,S. Defense,The user hurls a shadowy blob at the target. This has a 20% chance to lower the target's Sp. Def stat.,The user hurls a shadowy blob at the target. This may also lower the target’s Sp. Def stat.,"One other Pokémon on the field, selected by the trainer.",Shadow Ball,Smart,20,73
251,2,Future Sight,Psychic,80,100,120,10,0,,,S. Attack,S. Defense,"Two turns after this move is used, a hunk of psychic energy attacks the target's area. They're not charge turns since the user can still move.",Two turns after this move is used a hunk of psychic energy attacks the target.,"One other Pokémon on the field, selected by the trainer.",Future Sight,Smart,,149
252,2,Rock Smash,Fighting,100,100,40,15,0,,,Attack,Defense,The user attacks with a punch. This may also lower the target's Defense stat. This move will shatter walls.,The user attacks with a punch. This may also lower the target’s Defense stat.,"One other Pokémon on the field, selected by the trainer.",Rock Smash,Tough,50,70
253,2,Whirlpool,Water,100,85,35,15,0,,,S. Attack,S. Defense,The user traps the target in a violent swirling whirlpool for three turns.,The user traps the target in a violent swirling whirlpool for four to five turns.,"One other Pokémon on the field, selected by the trainer.",Whirlpool,Beauty,100,262
254,2,Beat Up,Dark,-1,100,25,10,0,,,Attack,Defense,The user hits the target as many times as there are nearby teammates.,The user gets all party Pokémon to attack the target. The more party Pokémon the greater the number of attacks.,"One other Pokémon on the field, selected by the trainer.",Beat Up,Smart,,155
255,3,Fake Out,Normal,100,100,40,10,3,,,Attack,Defense,An attack that hits from a distance and makes the target flinch. It fails on targets directly in front.,This attack hits first and makes the target flinch. It only works the first turn the user is in battle.,"One other Pokémon on the field, selected by the trainer.",Fake Out,Cute,100,159
256,3,Uproar,Normal,100,100,90,10,0,,,S. Attack,S. Defense,"The user attacks in an uproar, preventing everyone from falling asleep.",The user attacks in an uproar for three turns. During that time no Pokémon can fall asleep.,"One opposing Pokémon, selected at random.",Uproar,Cute,,160
257,3,Stockpile,Normal,-1,,,20,0,,,None,None,The user charges up power and raises both its Defense and Sp. Def. stats. The move can be used three times.,The user charges up power and raises both its Defense and Sp. Def stats. The move can be used three times.,The user.,Stockpile,Tough,,161
258,3,Spit Up,Normal,100,100,,10,0,,,S. Attack,S. Defense,"The power stored using the move Stockpile is released at once in an attack. The more power is stored, the more powerful the attack.",The power stored using the move Stockpile is released at once in an attack. The more power is stored the greater the move’s power.,"One other Pokémon on the field, selected by the trainer.",Spit Up,Tough,,162
