ID,Gen,Name,Type,AC (MD),AC,PW,PP,PR,Charge,Recoil,Power,Resist,Description,Old Description,Target,Alt Name,Contest Type,Effect Chance,Effect ID
606,6,Rototiller,Ground,-1,,,10,0,,,None,None,"The user overturns the soil, destroying traps and making it easier for plants to grow. This raises the Attack and Sp. Atk stats of Grass-type Pokémon.",Tilling the soil the user makes it easier for plants to grow. This raises the Attack and Sp. Atk stats of Grass-type Pokémon.,Every Pokémon on the field.,Rototiller,,100,340
607,6,Sticky Web,Bug,100,,,20,0,,,None,None,"The user shoots a sticky net at the target, causing its item to become sticky.",The user weaves a sticky net around the opposing team which lowers their Speed stat upon switching into battle.,The opposing side of the field.  Affects opposing Pokémon.,Sticky Web,,,341
608,6,Fell Stinger,Bug,100,100,50,25,0,,,Attack,Defense,"When the user knocks out a target with this move, the user’s Attack stat rises drastically.",When the user knocks out a target with this move the user’s Attack stat rises drastically.,"One other Pokémon on the field, selected by the trainer.",Fell Stinger,,,342
609,6,Phantom Force,Ghost,100,100,90,10,0,,,Attack,Defense,"The user vanishes somewhere, then strikes the target any time in the next 5 turns. This move hits even if the target protects itself.",The user vanishes somewhere then strikes the target on the next turn. This move hits even if the target protects itself.,"One other Pokémon on the field, selected by the trainer.",Phantom Force,,,273
610,6,Trick or Treat,Ghost,100,100,,20,0,,,None,None,The user takes the target trick-or-treating. This adds Ghost type to the target's type.,The user takes the target trick-or-treating. This adds Ghost type to the target’s type.,"One other Pokémon on the field, selected by the trainer.",Trick-or-Treat,,,343
611,6,Noble Roar,Normal,100,100,,30,0,,,None,None,"Letting out a noble roar, the user intimidates the target and lowers its Attack and Sp. Atk stats.",Letting out a noble roar the user intimidates the target and lowers its Attack and Sp. Atk stats.,"One other Pokémon on the field, selected by the trainer.",Noble Roar,,100,344
612,6,Ion Deluge,Electric,-1,,,25,1,,,None,None,"The user disperses electrically charged particles, which changes all moves by those affected to the Electric type.",The user disperses electrically charged particles which changes Normal-type moves to Electric-type moves.,The entire field.  Affects all Pokémon.,Ion Deluge,,,345
613,6,Parabolic Charge,Electric,100,100,65,20,0,,,S. Attack,S. Defense,The user attacks everything around it. The user's HP is restored by half the damage taken by those hit.,The user attacks everything around it. The user’s HP is restored by half the damage taken by those hit.,Every other Pokémon on the field.,Parabolic Charge,,,346
614,6,Forest’s Curse,Grass,100,100,,20,0,,,None,None,The user puts a forest curse on the target. Afflicted targets are now Grass type as well.,The user puts a forest curse on the target. The target is now Grass type as well.,"One other Pokémon on the field, selected by the trainer.",Forest's Curse,,,376
615,6,Petal Blizzard,Grass,90,100,90,15,0,,,Attack,Defense,The user stirs up a violent petal blizzard and attacks everything around it.,The user stirs up a violent petal blizzard and attacks everything around it.,Every other Pokémon on the field.,Petal Blizzard,,,379
616,6,Freeze Dry,Ice,90,100,70,20,0,,,S. Attack,S. Defense,The user rapidly cools the target. It has a 10% chance to freeze. This move is super effective on Water types.,The user rapidly cools the target. This may also leave the target frozen. This move is super effective on Water types.,"One other Pokémon on the field, selected by the trainer.",Freeze-Dry,,10,380
617,6,Disarming Voice,Fairy,-1,,40,15,0,,,S. Attack,S. Defense,"Letting out a charming cry, the user does emotional damage to opposing Pokémon. This attack never misses.",Letting out a charming cry the user does emotional damage to opposing Pokémon. This attack never misses.,All opposing Pokémon.,Disarming Voice,,,381
618,6,Parting Shot,Dark,-1,100,,20,0,,,None,None,"With a parting threat, the user lowers the target's Attack and Sp. Atk stats. Then it warps away.",With a parting threat the user lowers the target’s Attack and Sp. Atk stats. Then it switches with a party Pokémon.,"One other Pokémon on the field, selected by the trainer.",Parting Shot,,100,347
619,6,Topsy Turvy,Dark,-1,,,20,0,,,None,None,All stat changes affecting the targets turn topsy-turvy and become the opposite of what they were.,All stat changes affecting the target turn topsy-turvy and become the opposite of what they were.,"One other Pokémon on the field, selected by the trainer.",Topsy-Turvy,,,348
620,6,Draining Kiss,Fairy,100,100,50,10,0,,,S. Attack,S. Defense,The user steals the target's energy with a kiss. The user's HP is restored by 75% the damage taken by the target.,The user steals the target’s HP with a kiss. The user’s HP is restored by over half of the damage taken by the target.,"One other Pokémon on the field, selected by the trainer.",Draining Kiss,,,349
621,6,Crafty Shield,Fairy,-1,,,10,3,,,None,None,The user protects itself and its allies from status moves with a mysterious power. This does not stop moves that do damage.,The user protects itself and its allies from status moves with a mysterious power. This does not stop moves that do damage.,The user's side of the field.  Affects the user and its ally (if any).,Crafty Shield,,,350
622,6,Flower Shield,Fairy,-1,,,10,0,,,None,None,The user raises the Defense stat of all Pokémon in the party with a mysterious power.,The user raises the Defense stat of all Grass-type Pokémon in battle with a mysterious power.,Every Pokémon on the field.,Flower Shield,,100,351
623,6,Grassy Terrain,Grass,-1,,,10,0,,,None,None,The user covers the entire floor with grass. This restores the HP of all Pokémon except Flying types.,The user turns the ground to grass for five turns. This restores the HP of Pokémon on the ground a little every turn and powers up Grass type-moves.,The entire field.  Affects all Pokémon.,Grassy Terrain,,,352
624,6,Misty Terrain,Fairy,-1,,,10,0,,,None,None,The user covers the entire floor with mist. This protects Pokémon from status conditions.,This protects Pokémon on the ground from status conditions and halves damage from Dragon-type moves for five turns.,The entire field.  Affects all Pokémon.,Misty Terrain,,,353
625,6,Electrify,Electric,-1,,,20,0,,,None,None,"The target is electrified, converting its type to Electric.",If the target is electrified before it uses a move during that turn the target’s move becomes Electric type.,"One other Pokémon on the field, selected by the trainer.",Electrify,,,354
626,6,Play Rough,Fairy,100,90,90,10,0,,,Attack,Defense,The user plays rough with the target and attacks it. This has a 10% chance to lower the target's Attack stat.,The user plays rough with the target and attacks it. This may also lower the target’s Attack stat.,"One other Pokémon on the field, selected by the trainer.",Play Rough,,10,69
627,6,Fairy Wind,Fairy,100,100,40,30,0,,,S. Attack,S. Defense,The user stirs up a fairy wind and strikes the target with it.,The user stirs up a fairy wind and strikes the target with it.,"One other Pokémon on the field, selected by the trainer.",Fairy Wind,,,1
628,6,Moonblast,Fairy,100,100,95,15,0,,,S. Attack,S. Defense,"Borrowing the power of the moon, the user attacks the target. This has a 30% chance to lower the target's Sp. Atk stat.",Borrowing the power of the moon the user attacks the target. This may also lower the target’s Sp. Atk stat.,"One other Pokémon on the field, selected by the trainer.",Moonblast,,30,72
629,6,Boomburst,Normal,100,100,140,10,0,,,S. Attack,S. Defense,"The user attacks everything around it with the destructive power of a terrible, explosive sound. It fails if there's only 1 foe.",The user attacks everything around it with the destructive power of a terrible explosive sound.,Every other Pokémon on the field.,Boomburst,,,379
630,6,Fairy Lock,Fairy,-1,,,10,0,,,None,None,"By locking down the battlefield, the user immobilizes all other Pokémon in the area.",By locking down the battlefield the user keeps all Pokémon from fleeing during the next turn.,The entire field.  Affects all Pokémon.,Fairy Lock,,,355
631,6,King’s Shield,Steel,-1,,,10,4,,,None,None,The user takes a defensive stance while it protects itself from damage. It also harshly lowers the Attack stat of any attacker who makes direct contact.,The user takes a defensive stance while it protects itself from damage. It also harshly lowers the Attack stat of any attacker who makes direct contact.,The user.,King's Shield,,,356
632,6,Play Nice,Normal,-1,,,20,0,,,None,None,"The user and the target become friends, and the target loses its will to fight. This lowers the target's Sp. Atk stat.",The user and the target become friends and the target loses its will to fight. This lowers the target’s Attack stat.,"One other Pokémon on the field, selected by the trainer.",Play Nice,,100,357
633,6,Confide,Normal,-1,,,20,0,,,None,None,"The user tells the target a secret, and the target loses its ability to concentrate. This lowers the target's Sp. Atk stat.",The user tells the target a secret and the target loses its ability to concentrate. This lowers the target’s Sp. Atk stat.,"One other Pokémon on the field, selected by the trainer.",Confide,,100,358
634,6,Diamond Storm,Rock,95,95,100,5,0,,,Attack,Defense,The user whips up a storm of diamonds to damage opposing Pokémon. This may also sharply raise the user's Defense stat.,The user whips up a storm of diamonds to damage opposing Pokémon. This may also sharply raise the user’s Defense stat.,All opposing Pokémon.,Diamond Storm,,50,359
635,6,Steam Eruption,Water,95,95,110,5,0,,,S. Attack,S. Defense,The user immerses the target in superheated steam. This may also leave the target with a burn.,The user immerses the target in superheated steam. This may also leave the target with a burn.,"One other Pokémon on the field, selected by the trainer.",Steam Eruption,,30,5
636,6,Hyperspace Hole,Psychic,-1,,80,5,0,,,S. Attack,S. Defense,"Using a hyperspace hole, the user appears right next to the target and strikes. This also hits a target using Protect or Detect.",Using a hyperspace hole the user appears right next to the target and strikes. This also hits a target using a move such as Protect or Detect.,"One other Pokémon on the field, selected by the trainer.",Hyperspace Hole,,,360
637,6,Water Shuriken,Water,80,100,15,20,1,,,S. Attack,S. Defense,The user hits the target with throwing stars three times in a row.,The user hits the target with throwing stars two to five times in a row. This move always goes first.,"One other Pokémon on the field, selected by the trainer.",Water Shuriken,,,361
638,6,Mystical Fire,Fire,100,100,75,10,0,,,S. Attack,S. Defense,"The user attacks by breathing a special, hot fire. This also lowers the target's Sp. Atk stat.",The user attacks by breathing a special hot fire. This also lowers the target’s Sp. Atk stat.,"One other Pokémon on the field, selected by the trainer.",Mystical Fire,,100,72
639,6,Spiky Shield,Grass,-1,,,10,4,,,None,None,"In addition to protecting the user from attacks, this move also damages any attacker who makes direct contact.",In addition to protecting the user from attacks this move also damages any attacker who makes direct contact.,The user.,Spiky Shield,,,362
640,6,Aromatic Mist,Fairy,-1,,,20,0,,,None,None,The user sharply raises the Sp. Def stat of ally Pokémon with a mysterious aroma.,The user raises the Sp. Def stat of an ally Pokémon by using a mysterious aroma.,The user's ally (if any).,Aromatic Mist,,,363
641,6,Eerie Impulse,Electric,100,100,,15,0,,,None,None,The user's body generates an eerie impulse. Exposing the target to it harshly lowers the target's Sp. Atk stat.,The user’s body generates an eerie impulse. Exposing the target to it harshly lowers the target’s Sp. Atk stat.,"One other Pokémon on the field, selected by the trainer.",Eerie Impulse,,,62
642,6,Venom Drench,Poison,100,100,,20,0,,,None,None,"Opposing Pokémon are drenched in an odd poisonous liquid. This lowers their Attack, Sp. Atk, and Movement Speed.",Opposing Pokémon are drenched in an odd poisonous liquid. This lowers the Attack Sp. Atk and Speed stats of a poisoned target.,All opposing Pokémon.,Venom Drench,,100,364
643,6,Powder,Bug,100,100,,20,1,,,None,None,The user covers opponents in a powder that causes an explosion when exposed to fire or electricity.,The user covers the target in a combustible powder. If the target uses a Fire-type move the powder explodes and damages the target.,"One other Pokémon on the field, selected by the trainer.",Powder,,,378
644,6,Geomancy,Fairy,-1,,,10,0,1,,None,None,"The user absorbs energy and sharply raises its Sp. Atk, Sp. Def, and Speed stats on the next turn.",The user absorbs energy and sharply raises its Sp. Atk Sp. Def and Speed stats on the next turn.,The user.,Geomancy,,,366
645,6,Magnetic Flux,Electric,-1,,,20,0,,,None,None,The user manipulates magnetic fields which raises the Defense and Sp. Def stats of ally Pokémon.,The user manipulates magnetic fields which raises the Defense and Sp. Def stats of ally Pokémon with the Plus or Minus Ability.,The user and its allies.,Magnetic Flux,,,367
646,6,Happy Hour,Normal,-1,,,30,0,,,None,None,Using Happy Hour causes all ground ₽ to be doubled. Only works on ₽ that hasn't been touched by any Pokemon.,Using Happy Hour doubles the amount of prize money received after battle.,The user's side of the field.  Affects the user and its ally (if any).,Happy Hour,,,368
647,6,Electric Terrain,Electric,-1,,,10,0,,,None,None,The user electrifies the entire floor. Pokémon can no longer fall asleep.,The user electrifies the ground for five turns powering up Electric-type moves. Pokémon on the ground no longer fall asleep.,The entire field.  Affects all Pokémon.,Electric Terrain,,,369
648,6,Dazzling Gleam,Fairy,100,100,80,10,0,,,S. Attack,S. Defense,The user damages opposing Pokémon by emitting a powerful flash.,The user damages opposing Pokémon by emitting a powerful flash.,All opposing Pokémon.,Dazzling Gleam,,,1
649,6,Celebrate,Normal Fairy,-1,,,40,0,,,None,None,Yay!,The Pokémon congratulates you on your special day!,The user.,Celebrate,,,370
650,6,Hold Hands,Normal,-1,,,40,0,,,None,None,The user and an ally hold hands. This makes them very happy.,The user and an ally hold hands. This makes them very happy.,The user's ally (if any).,Hold Hands,,,371
651,6,Baby Doll Eyes,Fairy,100,100,,30,1,,,None,None,"The user stares at the target with its baby-doll eyes, which lowers its Attack stat.",The user stares at the target with its baby-doll eyes which lowers its Attack stat. This move always goes first.,"One other Pokémon on the field, selected by the trainer.",Baby-Doll Eyes,,,365
652,6,Nuzzle,Electric,100,100,20,20,0,,,Attack,Defense,The user attacks by nuzzling its electrified cheeks against the target. This also leaves the target with paralysis.,The user attacks by nuzzling its electrified cheeks against the target. This also leaves the target with paralysis.,"One other Pokémon on the field, selected by the trainer.",Nuzzle,,100,372
653,6,Hold Back,Normal,100,100,40,40,0,,,Attack,Defense,The user holds back when it attacks and the target is left with at least 1 HP.,The user holds back when it attacks and the target is left with at least 1 HP.,"One other Pokémon on the field, selected by the trainer.",Hold Back,,,102
654,6,Infestation,Bug,100,100,20,20,0,,,S. Attack,S. Defense,The target is infested and trapped for three turns.,The target is infested and attacked for four to five turns. The target can’t flee during this time.,"One other Pokémon on the field, selected by the trainer.",Infestation,,100,43
655,6,Power Up Punch,Fighting,100,100,40,20,0,,,Attack,Defense,Striking opponents over and over makes the user's fists harder. Hitting a target raises the Attack stat.,Striking opponents over and over makes the user’s fists harder. Hitting a target raises the Attack stat.,"One other Pokémon on the field, selected by the trainer.",Power-Up Punch,,100,375
656,6,Oblivion Wing,Flying,100,100,80,10,0,,,S. Attack,S. Defense,The user absorbs its target's HP. The user's HP is restored by 75% the damage taken by the target.,The user absorbs its target’s HP. The user’s HP is restored by over half of the damage taken by the target.,"One other Pokémon on the field, selected by the trainer.",Oblivion Wing,,,349
657,6,Thousand Arrows,Ground,100,100,90,10,0,,,Attack,Defense,This move also hits opposing Pokémon that are in the air. Those Pokémon are knocked down to the ground.,This move also hits opposing Pokémon that are in the air. Those Pokémon are knocked down to the ground.,All opposing Pokémon.,Thousand Arrows,,100,373
658,6,Thousand Waves,Ground,100,100,90,10,0,,,Attack,Defense,The user attacks with a wave that crawls along the ground. Those hit can't flee from battle.,The user attacks with a wave that crawls along the ground. Those hit can’t flee from battle.,All opposing Pokémon.,Thousand Waves,,,374
659,6,Land’s Wrath,Ground,100,100,90,10,0,,,Attack,Defense,The user gathers the energy of the land and focuses that power on opposing Pokémon to damage them.,The user gathers the energy of the land and focuses that power on opposing Pokémon to damage them.,All opposing Pokémon.,Land's Wrath,,,1
660,6,Light of Ruin,Fairy,90,90,140,5,0,,,S. Attack,S. Defense,"Drawing power from the Eternal Flower, the user fires a powerful beam of light. This also damages the user quite a lot.",Drawing power from the Eternal Flower the user fires a powerful beam of light. This also damages the user quite a lot.,"One other Pokémon on the field, selected by the trainer.",Light of Ruin,,,270
661,6,Origin Pulse,Water,85,85,110,10,0,,,S. Attack,S. Defense,The user attacks opposing Pokémon with countless beams of light that glow a deep and brilliant blue.,The user attacks opposing Pokémon with countless beams of light that glow a deep and brilliant blue.,All opposing Pokémon.,Origin Pulse,,,1
662,6,Precipice Blades,Ground,85,85,120,10,0,,,Attack,Defense,The user attacks opposing Pokémon by manifesting the power of the land in fearsome blades of stone.,The user attacks opposing Pokémon by manifesting the power of the land in fearsome blades of stone.,All opposing Pokémon.,Precipice Blades,,,1
663,6,Dragon Ascent,Flying,100,100,120,5,0,,,Attack,Defense,"After soaring upward, the user attacks its target by dropping out of the sky at high speeds, although it lowers its own Defense and Sp. Def in the process.",After soaring upward the user attacks its target by dropping out of the sky at high speeds. But it lowers its own Defense and Sp. Def stats in the process.,"One other Pokémon on the field, selected by the trainer.",Dragon Ascent,,100,230
664,6,Hyperspace Fury,Dark,-1,,100,5,0,,,Attack,Defense,"Using its many arms, the user unleashes a barrage of attacks that ignore the effects of moves like Protect and Detect. This attack lowers the user's Defense.",Using its many arms the user unleashes a barrage of attacks that ignore the effects of moves like Protect and Detect. But the user’s Defense stat falls.,"One other Pokémon on the field, selected by the trainer.",Hyperspace Fury,,100,360
665,6,Fog Bomb ,Dark,,,,,,,,,,+3 AC and EV for 1 turn,,,,,,
666,6,Torpedo ,Water,,,100,,,,,Attack,Defense,-1 DF to foe,,,,,,
667,7,Shore Up,Ground,-1,,,10,0,,,None,None,The user regains up to half of its max HP. It restores more HP in a sandstorm.,The user regains up to half of its max HP. It restores more HP in a sandstorm.,The user.,Shore Up,,,382
668,7,First Impression,Bug,100,100,110,10,2,,,Attack,Defense,"Although this move has great power and speed, it only works once per floor.",Although this move has great power it only works the first turn the user is in battle.,"One other Pokémon on the field, selected by the trainer.",First Impression,,,383
669,7,Baneful Bunker,Poison,-1,,,10,4,,,None,None,"In addition to protecting the user from attacks, this move also poisons any attacker that makes direct contact.",In addition to protecting the user from attacks this move also poisons any attacker that makes direct contact.,The user.,Baneful Bunker,,,384
670,7,Spirit Shackle,Ghost,100,100,80,10,0,,,Attack,Defense,The user attacks while simultaneously stitching the target's shadow to the ground to prevent the target from escaping.,The user attacks while simultaneously stitching the target’s shadow to the ground to prevent the target from escaping.,"One other Pokémon on the field, selected by the trainer.",Spirit Shackle,,,385
671,7,Darkest Lariat,Dark,100,100,85,10,0,,,Attack,Defense,The user swings both arms and hits the target. The target's stat changes don't affect this attack's damage.,The user swings both arms and hits the target. The target’s stat changes don’t affect this attack’s damage.,"One other Pokémon on the field, selected by the trainer.",Darkest Lariat,,,304
672,7,Sparkling Aria,Water,100,100,90,10,0,,,S. Attack,S. Defense,"The user bursts into song, emitting many bubbles. Any Pokémon suffering from a burn will be healed by the touch of these bubbles.",The user bursts into song emitting many bubbles. Any Pokémon suffering from a burn will be healed by the touch of these bubbles.,Every other Pokémon on the field.,Sparkling Aria,,,386
673,7,Ice Hammer,Ice,90,90,100,10,0,,,Attack,Defense,"The user swings and hits with its strong, heavy fist. It lowers the user's Speed, however.",The user swings and hits with its strong heavy fist. It lowers the user’s Speed however.,"One other Pokémon on the field, selected by the trainer.",Ice Hammer,,100,219
674,7,Floral Healing,Fairy,-1,,,10,0,,,None,None,The user restores the target's HP by up to half of its max HP. It restores more HP when the terrain is grass.,The user restores the target’s HP by up to half of its max HP. It restores more HP when the terrain is grass.,"One other Pokémon on the field, selected by the trainer.",Floral Healing,,,387
675,7,High Horsepower,Ground,95,95,95,10,0,,,Attack,Defense,The user fiercely attacks the target using its entire body.,The user fiercely attacks the target using its entire body.,"One other Pokémon on the field, selected by the trainer.",High Horsepower,,,1
676,7,Strength Sap,Grass,100,100,,10,0,,,None,None,The user restores its HP by the same amount as the target's Attack stat. It also lowers the target's Attack stat.,The user restores its HP by the same amount as the target’s Attack stat. It also lowers the target’s Attack stat.,"One other Pokémon on the field, selected by the trainer.",Strength Sap,,100,388
677,7,Solar Blade,Grass,100,100,125,10,0,,,Attack,Defense,"The user gathers light and fills a blade with the light's energy, attacking the target on the next turn. In sunlight, the charge is skipped and it never misses.",In this two-turn attack the user gathers light and fills a blade with the light’s energy attacking the target on the next turn.,"One other Pokémon on the field, selected by the trainer.",Solar Blade,,,152
678,7,Leafage,Grass,100,100,40,40,0,,,Attack,Defense,The user attacks by pelting the target with leaves.,The user attacks by pelting the target with leaves.,"One other Pokémon on the field, selected by the trainer.",Leafage,,,1
679,7,Spotlight,Normal,-1,,,15,3,,,None,None,The user shines a spotlight on the target so that only the target will be attacked during the turn.,The user shines a spotlight on the target so that only the target will be attacked during the turn.,"One other Pokémon on the field, selected by the trainer.",Spotlight,,,389
680,7,Toxic Thread,Poison,100,100,,20,0,,,None,None,The user shoots poisonous threads to poison the target and lower the target's Speed stat.,The user shoots poisonous threads to poison the target and lower the target’s Speed stat.,"One other Pokémon on the field, selected by the trainer.",Toxic Thread,,100,390
681,7,Laser Focus,Normal,-1,,,30,0,,,None,None,The user concentrates intensely. The attack on the next turn always results in a critical hit.,The user concentrates intensely. The attack on the next turn always results in a critical hit.,The user.,Laser Focus,,,391
682,7,Gear Up,Steel,-1,,,20,0,,,None,None,The user engages its gears to raise the Attack and Sp. Atk stats of ally Pokémon with the Plus or Minus Ability.,The user engages its gears to raise the Attack and Sp. Atk stats of ally Pokémon with the Plus or Minus Ability.,The user and its allies.,Gear Up,,,392
683,7,Throat Chop,Dark,100,100,80,15,0,,,Attack,Defense,"The user attacks the target's throat, and the resultant suffering prevents the target from using moves that emit sound for two turns.",The user attacks the target’s throat and the resultant suffering prevents the target from using moves that emit sound for two turns.,"One other Pokémon on the field, selected by the trainer.",Throat Chop,,100,393
684,7,Pollen Puff,Bug,100,100,90,15,0,,,S. Attack,S. Defense,"The user attacks the enemy with a pollen puff that explodes. If the target is an ally, it gives the ally a pollen puff that restores its HP instead.",The user attacks the enemy with a pollen puff that explodes. If the target is an ally it gives the ally a pollen puff that restores its HP instead.,"One other Pokémon on the field, selected by the trainer.",Pollen Puff,,,394
