ID,Gen,Name,Type,AC (MD),AC,PW,PP,PR,Charge,Recoil,Power,Resist,Description,Old Description,Target,Alt Name,Contest Type,Effect Chance,Effect ID
345,3,Poison Tail,Poison,100,100,50,25,0,,,Attack,Defense,The user hits the target with its tail. This may also poison the target. Critical hits land more easily.,The user hits the target with its tail. This may also poison the target. Critical hits land more easily.,"One other Pokémon on the field, selected by the trainer.",Poison Tail,Smart,10,210
346,3,Covet,Normal,80,100,60,25,0,,,Attack,Defense,The user cutely begs to obtain an item from the foe.,The user endearingly approaches the target then steals the target’s held item.,"One other Pokémon on the field, selected by the trainer.",Covet,Cute,,106
347,3,Volt Tackle,Electric,100,100,120,15,0,,,Attack,Defense,"The user electrifies itself, then charges. This also damages the user quite a lot. This may leave the target with paralysis.",The user electrifies itself and charges the target. This also damages the user quite a lot. This attack may leave the target with paralysis.,"One other Pokémon on the field, selected by the trainer.",Volt Tackle,Cool,10,263
348,3,Magical Leaf,Grass,-1,,60,20,0,,,S. Attack,S. Defense,The user scatters curious leaves that chase the target. This attack never misses.,The user scatters curious leaves that chase the target. This attack never misses.,"One other Pokémon on the field, selected by the trainer.",Magical Leaf,Beauty,,18
349,3,Water Sport,Water,100,,,15,0,,,None,None,The user soaks everyone with water. This adds the Water-type to their typing.,The user soaks the battlefield with water. This weakens Fire-type moves for five turns.,The entire field.  Affects all Pokémon.,Water Sport,Cute,,211
350,3,Calm Mind,Psychic,-1,,,20,0,,,None,None,The user quietly focuses its mind and calms its spirit to raise its Sp. Atk and Sp. Def stats.,The user quietly focuses its mind and calms its spirit to raise its Sp. Atk and Sp. Def stats.,The user.,Calm Mind,Smart,,212
351,3,Leaf Blade,Grass,100,100,90,15,0,,,Attack,Defense,The user handles a sharp leaf like a sword and attacks by cutting its target. Critical hits land more easily.,The user handles a sharp leaf like a sword and attacks by cutting its target. Critical hits land more easily.,"One other Pokémon on the field, selected by the trainer.",Leaf Blade,Cool,,44
352,3,Dragon Dance,Dragon,-1,,,20,0,,,None,None,"The user vigorously performs a mystic, powerful dance that boosts its Attack and Movement Speed.",The user vigorously performs a mystic powerful dance that raises its Attack and Speed stats.,The user.,Dragon Dance,Cool,,213
353,3,Rock Blast,Rock,50,90,25,10,0,,,Attack,Defense,The user hurls hard rocks at the target. Five rocks are launched in a row.,The user hurls hard rocks at the target. Two to five rocks are launched in a row.,"One other Pokémon on the field, selected by the trainer.",Rock Blast,Tough,,30
354,3,Shock Wave,Electric,-1,,60,20,0,,,S. Attack,S. Defense,The user strikes the target with a quick jolt of electricity. This attack never misses.,The user strikes the target with a quick jolt of electricity. This attack never misses.,"One other Pokémon on the field, selected by the trainer.",Shock Wave,Cool,,18
355,3,Water Pulse,Water,100,100,60,20,0,,,S. Attack,S. Defense,The user attacks the target with a pulsing blast of water. This may also confuse the target.,The user attacks the target with a pulsing blast of water. This may also confuse the target.,"One other Pokémon on the field, selected by the trainer.",Water Pulse,Beauty,20,77
356,3,Doom Desire,Steel,100,100,140,5,0,2,,S. Attack,S. Defense,Two turns after this move is used a concentrated bundle of light blasts the target. ,Two turns after this move is used a concentrated bundle of light blasts the target. ,"One other Pokémon on the field, selected by the trainer.",Doom Desire,Cool,,149
357,3,Psycho Boost,Psychic,100,90,140,5,0,,,S. Attack,S. Defense,The user attacks the target at full power. The attack's recoil harshly lowers the user's Sp. Atk stat.,The user attacks the target at full power. The attack’s recoil harshly lowers the user’s Sp. Atk stat.,"One other Pokémon on the field, selected by the trainer.",Psycho Boost,Smart,100,205
358,3,Shadow Rush,Shadow,,100,55,,0,,,Attack,Defense,,,"One other Pokémon on the field, selected by the trainer.",Shadow Rush,,,10001
359,3,Shadow Blast,Shadow,,100,80,,0,,,Attack,Defense,,,"One other Pokémon on the field, selected by the trainer.",Shadow Blast,,,44
360,3,Shadow Blitz,Shadow,,100,40,,0,,,Attack,Defense,,,"One other Pokémon on the field, selected by the trainer.",Shadow Blitz,,,1
361,3,Shadow Bolt,Shadow,,100,75,,0,,,S. Attack,S. Defense,,,"One other Pokémon on the field, selected by the trainer.",Shadow Bolt,,10,7
362,3,Shadow Break,Shadow,,100,75,,0,,,Attack,Defense,,,"One other Pokémon on the field, selected by the trainer.",Shadow Break,,,1
363,3,Shadow Chill,Shadow,,100,75,,0,,,S. Attack,S. Defense,,,"One other Pokémon on the field, selected by the trainer.",Shadow Chill,,10,6
364,3,Shadow End,Shadow,,60,120,,0,,,Attack,Defense,,,"One other Pokémon on the field, selected by the trainer.",Shadow End,,,10002
365,3,Shadow Fire,Shadow,,100,75,,0,,,S. Attack,S. Defense,,,"One other Pokémon on the field, selected by the trainer.",Shadow Fire,,10,5
366,3,Shadow Rave,Shadow,,100,70,,0,,,S. Attack,S. Defense,,,The opposing side of the field.  Affects opposing Pokémon.,Shadow Rave,,,1
367,3,Shadow Storm,Shadow,,100,95,,0,,,S. Attack,S. Defense,,,The opposing side of the field.  Affects opposing Pokémon.,Shadow Storm,,,1
368,3,Shadow Wave,Shadow,,100,50,,0,,,S. Attack,S. Defense,,,The opposing side of the field.  Affects opposing Pokémon.,Shadow Wave,,,1
369,3,Shadow Down,Shadow,,100,,,0,,,None,None,,,The opposing side of the field.  Affects opposing Pokémon.,Shadow Down,,,60
370,3,Shadow Half,Shadow,,100,,,0,,,S. Attack,S. Defense,,,The entire field.  Affects all Pokémon.,Shadow Half,,,10003
371,3,Shadow Step,Shadow,,,,,,,,,,,,,,,,
372,3,Shadow Hold,Shadow,,,,,0,,,None,None,,,The opposing side of the field.  Affects opposing Pokémon.,Shadow Hold,,,107
373,3,Shadow Mist,Shadow,,100,,,0,,,None,None,,,The opposing side of the field.  Affects opposing Pokémon.,Shadow Mist,,,10004
374,3,Shadow Panic,Shadow,,90,,,0,,,None,None,,,The opposing side of the field.  Affects opposing Pokémon.,Shadow Panic,,,50
375,3,Shadow Shed,Shadow,,,,,0,,,None,None,,,The entire field.  Affects all Pokémon.,Shadow Shed,,,10005
376,3,Shadow Sky,Shadow,,,,,0,,,None,None,,,The entire field.  Affects all Pokémon.,Shadow Sky,,,10006
377,3,Wide Slash,Unknown,,,,,,,,,,,,Wide Slash,Wide Slash,,,
378,3,Vacuum Cut,Unknown,,,,,,,,,,,,The entire field.  Affects all Pokémon.,Vacuum Cut,,,
379,3,Excavate,,,,,,,,,,,,,,Excavate,,,
380,3,Spin Slash,,,,,,,,,,,,,,Spin Slash,,,
381,3,Obstruction ,Dark,,,,,,,,Parry,Parry,-1 DF to foe if hit,,,,,,
382,4,Roost,Flying,-1,,,10,0,,,None,None,"The user lands and rests its body. It removes Levitate and Flying type for one turn, but restores the user’s HP by up to half of its max HP.",The user lands and rests its body. It restores the user’s HP by up to half of its max HP.,The user.,Roost,Cool,,215
383,4,Gravity,Psychic,-1,,,5,0,,,None,None,"Gravity is intensified for the entire floor, making moves involving flying unusable and negating Levitate.",Enables Flying-type Pokémon or Pokémon with the Levitate Ability to be hit by Ground-type moves. Flying moves can’t be used.,The entire field.  Affects all Pokémon.,Gravity,Beauty,,216
384,4,Miracle Eye,Psychic,-1,,,40,0,,,None,None,"The user takes on the Miracle Eye status, allowing it to ignore resistances and immunities. This also enables it to hit evasive targets.",Enables a Dark-type target to be hit by Psychic-type attacks. This also enables an evasive target to be hit.,"One other Pokémon on the field, selected by the trainer.",Miracle Eye,Cute,,217
385,4,Wake Up Slap,Fighting,100,100,70,10,0,,,Attack,Defense,"This attack inflicts big damage on a sleeping target, immediately waking it up. Allies targeted by this move will not take damage.",This attack inflicts big damage on a sleeping target. This also wakes the target up however.,"One other Pokémon on the field, selected by the trainer.",Wake-Up Slap,Smart,,218
386,4,Hammer Arm,Fighting,90,90,100,10,0,,,Attack,Defense,"The user swings and hits with its strong and heavy fist. It lowers the user’s Movement Speed, however.",The user swings and hits with its strong heavy fist. It lowers the user’s Speed however.,"One other Pokémon on the field, selected by the trainer.",Hammer Arm,Cool,100,219
387,4,Gyro Ball,Steel,100,100,,5,0,,,Attack,Defense,"The user tackles the target with a high-speed spin. The slower the user compared to the target, the greater the move's power.",The user tackles the target with a high-speed spin. The slower the user compared to the target the greater the move’s power.,"One other Pokémon on the field, selected by the trainer.",Gyro Ball,Beauty,,220
388,4,Healing Wish,Psychic,-1,,,10,0,,,None,None,"The user's HP drops to 1. In return, the rest of the party will have its HP restored and status conditions cured.",The user faints. In return the Pokémon taking its place will have its HP restored and status conditions cured.,The user.,Healing Wish,Cute,,221
389,4,Brine,Water,100,100,65,10,0,,,S. Attack,S. Defense,"If the target's HP is half or less, this attack will hit with double the power.",If the target’s HP is half or less this attack will hit with double the power.,"One other Pokémon on the field, selected by the trainer.",Brine,Smart,,222
390,4,Natural Gift,Normal,100,100,,15,0,,,Attack,Defense,The user draws power to attack by using its held Berry. The Berry determines the move's type.,The user draws power to attack by using its held Berry. The Berry determines the move’s type and power.,"One other Pokémon on the field, selected by the trainer.",Natural Gift,Cool,,223
391,4,Feint,Normal,100,100,30,10,2,,,Attack,Defense,An attack that hits a target trying to protect itself. This also lifts the effects of those moves.,This attack hits a target using a move such as Protect or Detect. This also lifts the effects of those moves.,"One other Pokémon on the field, selected by the trainer.",Feint,Beauty,,224
392,4,Pluck,Flying,100,100,60,20,0,,,Attack,Defense,"The user pecks the target. If the target is holding a Berry, the user eats it and gains its effect.",The user pecks the target. If the target is holding a Berry the user eats it and gains its effect.,"One other Pokémon on the field, selected by the trainer.",Pluck,Cute,,225
393,4,Tailwind,Flying,-1,,,15,0,,,None,None,The user whips up a turbulent whirlwind that sharply raises the Movement Speed of the user and its allies.,The user whips up a turbulent whirlwind that ups the Speed stat of the user and its allies for four turns.,The user's side of the field.  Affects the user and its ally (if any).,Tailwind,Smart,,226
394,4,Acupressure,Normal,-1,,,30,0,,,None,None,"The user applies pressure to an ally's stress points, sharply boosting its highest stat.",The user applies pressure to stress points sharply boosting one of its or its allies’ stats.,"Either the user or its ally, selected by the trainer.",Acupressure,Cool,,227
395,4,Metal Burst,Steel,-1,100,,10,0,,,Attack,Defense,"When damaged, the user retaliates with much greater power against nearby opponents.",The user retaliates with much greater force against the opponent that last inflicted damage on it.,One specific move.  How this move is chosen depends upon on the move being used.,Metal Burst,Beauty,,228
396,4,U turn,Bug,100,100,70,20,0,,,Attack,Defense,"After making its attack, the user jumps back several steps.",After making its attack the user rushes back to switch places with a party Pokémon in waiting.,"One other Pokémon on the field, selected by the trainer.",U-turn,Cute,,229
397,4,Close Combat,Fighting,100,100,120,5,0,,,Attack,Defense,The user fights the target up close without guarding itself. This also lowers the user's Defense and Sp. Def stats.,The user fights the target up close without guarding itself. This also lowers the user’s Defense and Sp. Def stats.,"One other Pokémon on the field, selected by the trainer.",Close Combat,Smart,100,230
398,4,Payback,Dark,100,100,50,10,0,,,Attack,Defense,"The user stores power, then attacks. If the user was last hit by the target, this attack's power will be doubled.",The user stores power then attacks. If the user moves after the target this attack’s power will be doubled.,"One other Pokémon on the field, selected by the trainer.",Payback,Cool,,231
399,4,Assurance,Dark,100,100,60,10,0,,,Attack,Defense,"If the target was last attacked by the user, this attack's power is doubled.",If the target has already taken some damage in the same turn this attack’s power is doubled.,"One other Pokémon on the field, selected by the trainer.",Assurance,Beauty,,232
400,4,Embargo,Dark,100,100,,15,0,,,None,None,This move prevents foes from using any items.,This move prevents the target from using its held item for five turns. Its Trainer is also prevented from using items on it.,"One other Pokémon on the field, selected by the trainer.",Embargo,Cute,,233
401,4,Fling,Dark,-1,100,,10,0,,,Attack,Defense,The user flings its held equipment at the target to attack. This move’s power and effects depend on the item.,The user flings its held item at the target to attack. This move’s power and effects depend on the item.,"One other Pokémon on the field, selected by the trainer.",Fling,Tough,,234
402,4,Psycho Shift,Psychic,-1,100,,10,0,,,None,None,"Using its psychic power of suggestion, the user transfers its bad status conditions to the target.",Using its psychic power of suggestion the user transfers its status conditions to the target.,"One other Pokémon on the field, selected by the trainer.",Psycho Shift,Cool,,235
403,4,Trump Card,Normal,-1,,,5,0,,,S. Attack,S. Defense,"The more PP this move has, the greater its power.",The fewer PP this move has the greater its power.,"One other Pokémon on the field, selected by the trainer.",Trump Card,Cool,,236
404,4,Heal Block,Psychic,100,100,,15,0,,,None,None,The user prevents the opposing team from recovering HP.,For five turns the user prevents the opposing team from using any moves Abilities or held items that recover HP.,All opposing Pokémon.,Heal Block,Cute,,237
405,4,Wring Out,Normal,100,100,,5,0,,,S. Attack,S. Defense,"The user powerfully wrings the target. The more HP the target has, the greater the move's power.",The user powerfully wrings the target. The more HP the target has the greater the move’s power.,"One other Pokémon on the field, selected by the trainer.",Wring Out,Smart,,238
406,4,Power Trick,Psychic,-1,,,10,0,,,None,None,The user employs its psychic power to switch its Attack with its Defense stat.,The user employs its psychic power to switch its Attack stat with its Defense stat.,The user.,Power Trick,Cool,,239
407,4,Gastro Acid,Poison,100,100,,10,0,,,None,None,The user hurls up its stomach acids on the target. The fluid eliminates the effect of the target's Ability.,The user hurls up its stomach acids on the target. The fluid eliminates the effect of the target’s Ability.,"One other Pokémon on the field, selected by the trainer.",Gastro Acid,Beauty,,240
408,4,Lucky Chant,Normal,-1,,,30,0,,,None,None,"The user chants an incantation toward the sky, preventing opposing Pokémon from landing critical hits or additional effects.",The user chants an incantation toward the sky preventing opposing Pokémon from landing critical hits for five turns.,The user's side of the field.  Affects the user and its ally (if any).,Lucky Chant,Cute,,241
409,4,Me First,Normal,-1,,,20,0,,,None,None,The user cuts ahead of the target to steal and use the target's strongest move. It fails if the target has no attacking moves.,The user cuts ahead of the target to copy and use the target’s intended move with greater power. This move fails if it isn’t used first.,"One other Pokémon on the field, selected by the trainer.  Stolen moves reuse the same target.",Me First,Cute,,242
410,4,Copycat,Normal,-1,,,20,0,,,None,None,The user mimics the move last used by the target. The move fails if the target hasn't used a move yet.,The user mimics the move used immediately before it. The move fails if no other move has been used yet.,The user.,Copycat,Cool,,243
411,4,Power Swap,Psychic,-1,,,10,0,,,None,None,The user employs its psychic power to switch changes to its Attack and Sp. Atk stats with the target.,The user employs its psychic power to switch changes to its Attack and Sp. Atk stats with the target.,"One other Pokémon on the field, selected by the trainer.",Power Swap,Beauty,,244
412,4,Guard Swap,Psychic,-1,,,10,0,,,None,None,The user employs its psychic power to switch changes to its Defense and Sp. Def stats with the target.,The user employs its psychic power to switch changes to its Defense and Sp. Def stats with the target.,"One other Pokémon on the field, selected by the trainer.",Guard Swap,Cute,,245
413,4,Punishment,Dark,100,100,,5,0,,,Attack,Defense,This move gets an extra 20 power for each of the foe's stat boosts,The more the target has powered up with stat changes the greater the move’s power.,"One other Pokémon on the field, selected by the trainer.",Punishment,Smart,,246
414,4,Last Resort,Normal,100,100,140,5,0,,,Attack,Defense,"The less total PP the user has, the greater the move's power.",This move can be used only after the user has used all the other moves it knows in the battle.,"One other Pokémon on the field, selected by the trainer.",Last Resort,Cute,,247
415,4,Worry Seed,Grass,100,100,,10,0,,,None,None,A seed that causes worry is planted on the target. It prevents sleep by making the target's Ability Insomnia.,A seed that causes worry is planted on the target. It prevents sleep by making the target’s Ability Insomnia.,"One other Pokémon on the field, selected by the trainer.",Worry Seed,Beauty,,248
416,4,Sucker Punch,Dark,100,100,70,5,1,,,Attack,Defense,This attacks foes from a distance. It fails on targets directly in front.,This move enables the user to attack first. This move fails if the target is not readying an attack.,"One other Pokémon on the field, selected by the trainer.",Sucker Punch,Smart,,249
417,4,Toxic Spikes,Poison,-1,,,20,0,,,None,None,The user lays a trap of poison spikes around itself. They badly poison opposing Pokémon that step on it.,The user lays a trap of poison spikes at the feet of the opposing team. The spikes will poison opposing Pokémon that switch into battle.,The opposing side of the field.  Affects opposing Pokémon.,Toxic Spikes,Smart,,250
418,4,Heart Swap,Psychic,-1,,,10,0,,,None,None,The user employs its psychic power to switch stat changes with the target.,The user employs its psychic power to switch stat changes with the target.,"One other Pokémon on the field, selected by the trainer.",Heart Swap,Cool,,251
419,4,Aqua Ring,Water,-1,,,20,0,,,None,None,The user envelops the party in a veil made of water. It restores some HP every turn.,The user envelops itself in a veil made of water. It regains some HP every turn.,The user.,Aqua Ring,Beauty,,252
420,4,Magnet Rise,Electric,-1,,,10,0,,,None,None,"The user levitates itself and allies using electrically generated magnetism, for 5 turns.",The user levitates using electrically generated magnetism for five turns.,The user.,Magnet Rise,Cute,,253
421,4,Flare Blitz,Fire,100,100,120,15,0,,,Attack,Defense,"The user cloaks itself in fire and charges the target. This has a 10% chance to burn the target, and deals 33% recoil damage to the user.",The user cloaks itself in fire and charges the target. This also damages the user quite a lot. This attack may leave the target with a burn.,"One other Pokémon on the field, selected by the trainer.",Flare Blitz,Smart,10,254
422,4,Force Palm,Fighting,100,100,60,10,0,,,Attack,Defense,The target is attacked with a shock wave. This may also leave the target with paralysis.,The target is attacked with a shock wave. This may also leave the target with paralysis.,"One other Pokémon on the field, selected by the trainer.",Force Palm,Cool,30,7
423,4,Aura Sphere,Fighting,-1,,90,20,0,,,S. Attack,S. Defense,The user lets loose a blast of aura power from deep within its body at the target. This attack never misses.,The user lets loose a blast of aura power from deep within its body at the target. This attack never misses.,"One other Pokémon on the field, selected by the trainer.",Aura Sphere,Beauty,,18
424,4,Rock Polish,Rock,-1,,,20,0,,,None,None,The user polishes its body to reduce drag. This can sharply raise its Movement Speed.,The user polishes its body to reduce drag. This can sharply raise the Speed stat.,The user.,Rock Polish,Tough,,53
425,4,Poison Jab,Poison,100,100,80,20,0,,,Attack,Defense,The target is stabbed with a tentacle or arm steeped in poison. This has a 30% chance to poison the target.,The target is stabbed with a tentacle or arm steeped in poison. This may also poison the target.,"One other Pokémon on the field, selected by the trainer.",Poison Jab,Smart,30,3
426,4,Dark Pulse,Dark,100,100,80,15,0,,,S. Attack,S. Defense,The user releases a horrible aura imbued with dark thoughts. This has a 20% chance to make the target flinch.,The user releases a horrible aura imbued with dark thoughts. This may also make the target flinch.,"One other Pokémon on the field, selected by the trainer.",Dark Pulse,Cool,20,32
427,4,Night Slash,Dark,100,100,70,15,0,,,Attack,Defense,The user slashes the target the instant an opportunity arises. Critical hits land more easily.,The user slashes the target the instant an opportunity arises. Critical hits land more easily.,"One other Pokémon on the field, selected by the trainer.",Night Slash,Beauty,,44
428,4,Aqua Tail,Water,90,90,90,10,0,,,Attack,Defense,The user attacks by swinging its tail as if it were a vicious wave in a raging storm.,The user attacks by swinging its tail as if it were a vicious wave in a raging storm.,"One other Pokémon on the field, selected by the trainer.",Aqua Tail,Cute,,1
429,4,Seed Bomb,Grass,100,100,80,15,0,,,Attack,Defense,The user slams a barrage of hard-shelled seeds on the target from above.,The user slams a barrage of hard-shelled seeds down on the target from above.,"One other Pokémon on the field, selected by the trainer.",Seed Bomb,Smart,,1
430,4,Air Slash,Flying,100,95,75,15,0,,,S. Attack,S. Defense,The user attacks with a blade of air that slices even the sky. This has a 30% chance to make the target flinch.,The user attacks with a blade of air that slices even the sky. This may also make the target flinch.,"One other Pokémon on the field, selected by the trainer.",Air Slash,Cool,30,32
431,4,X Scissor,Bug,100,100,80,15,0,,,Attack,Defense,The user slashes at the target by crossing its scythes or claws as if they were a pair of scissors.,The user slashes at the target by crossing its scythes or claws as if they were a pair of scissors.,"One other Pokémon on the field, selected by the trainer.",X-Scissor,Beauty,,1
432,4,Bug Buzz,Bug,100,100,90,10,0,,,S. Attack,S. Defense,The user vibrates its wings to generate a damaging sound wave. This may also lower the target's Sp. Def stat.,The user generates a damaging sound wave by vibration. This may also lower the target’s Sp. Def stat.,"One other Pokémon on the field, selected by the trainer.",Bug Buzz,Cute,10,73
433,4,Dragon Pulse,Dragon,100,100,85,10,0,,,S. Attack,S. Defense,The target is attacked with a shock wave generated by the user's gaping mouth.,The target is attacked with a shock wave generated by the user’s gaping mouth.,"One other Pokémon on the field, selected by the trainer.",Dragon Pulse,Smart,,1
434,4,Dragon Rush,Dragon,70,75,100,10,0,,,Attack,Defense,The user tackles the target while exhibiting overwhelming menace. This has a 20% chance to make the target flinch.,The user tackles the target while exhibiting overwhelming menace. This may also make the target flinch.,"One other Pokémon on the field, selected by the trainer.",Dragon Rush,Cool,20,32
435,4,Power Gem,Rock,100,100,80,20,0,,,S. Attack,S. Defense,The user attacks with rays of light that sparkle as if they were made of gemstones.,The user attacks with a ray of light that sparkles as if it were made of gemstones.,"One other Pokémon on the field, selected by the trainer.",Power Gem,Beauty,,1
436,4,Drain Punch,Fighting,100,100,75,10,0,,,Attack,Defense,An energy-draining punch. The user's HP is restored by half the damage taken by the target.,An energy-draining punch. The user’s HP is restored by half the damage taken by the target.,"One other Pokémon on the field, selected by the trainer.",Drain Punch,Beauty,,4
437,4,Vacuum Wave,Fighting,100,100,40,30,1,,,S. Attack,S. Defense,The user whirls its fists to send a wave of pure vacuum at the target.,The user whirls its fists to send a wave of pure vacuum at the target. This move always goes first.,"One other Pokémon on the field, selected by the trainer.",Vacuum Wave,Smart,,104
438,4,Focus Blast,Fighting,70,70,120,5,0,,,S. Attack,S. Defense,The user heightens its mental focus and unleashes its power. This may also lower the target’s Sp. Def.,The user heightens its mental focus and unleashes its power. This may also lower the target’s  Sp. Def stat.,"One other Pokémon on the field, selected by the trainer.",Focus Blast,Cool,10,73
439,4,Energy Ball,Grass,100,100,90,10,0,,,S. Attack,S. Defense,The user draws power from nature and fires it at the target. This has a 10% chance to lower the target's Sp. Def.,The user draws power from nature and fires it at the target. This may also lower the target’s Sp. Def stat.,"One other Pokémon on the field, selected by the trainer.",Energy Ball,Beauty,10,73
