ID,Gen,Name,Type,AC (MD),AC,PW,PP,PR,Charge,Recoil,Power,Resist,Description,Old Description,Target,Alt Name,Contest Type,Effect Chance,Effect ID
1,1,Pound,Normal,100,100,40,35,0,,,Attack,Defense,"The target is physically pounded with a long tail, a foreleg, or the like.",The target is physically pounded with a long tail a foreleg or the like.,"One other Pokémon on the field, selected by the trainer.",Pound,Tough,,1
2,1,Karate Chop,Fighting,100,100,50,25,0,,,Attack,Defense,The target is attacked with a sharp chop. Critical hits land more easily.,The target is attacked with a sharp chop. Critical hits land more easily.,"One other Pokémon on the field, selected by the trainer.",Karate Chop,Tough,,44
3,1,Double Slap,Normal,50,85,15,10,0,,,Attack,Defense,"The target is slapped repeatedly, back and forth, four times in a row.",The target is slapped repeatedly back and forth two to five times in a row.,"One other Pokémon on the field, selected by the trainer.",Double Slap,Tough,,30
4,1,Comet Punch,Normal,50,85,18,15,0,,,Attack,Defense,The target is hit with a flurry of punches that strike four times in a row.,The target is hit with a flurry of punches that strike two to five times in a row.,"One other Pokémon on the field, selected by the trainer.",Comet Punch,Tough,,30
5,1,Mega Punch,Normal,80,85,80,20,0,,,Attack,Defense,The target is slugged by a punch thrown with muscle-packed power.,The target is slugged by a punch thrown with muscle-packed power.,"One other Pokémon on the field, selected by the trainer.",Mega Punch,Tough,,1
6,1,Pay Day,Normal,100,100,40,20,0,,,Attack,Defense,Numerous coins are hurled at the target to inflict damage. It causes the target to drop a portion of its money.,Numerous coins are hurled at the target to inflict damage. Money is earned after the battle.,"One other Pokémon on the field, selected by the trainer.",Pay Day,Smart,,35
7,1,Fire Punch,Fire,100,100,75,15,0,,,Attack,Defense,The target is punched with a fiery fist. This has a 10% chance to leave the target with a burn.,The target is punched with a fiery fist. This may also leave the target with a burn.,"One other Pokémon on the field, selected by the trainer.",Fire Punch,Beauty,10,5
8,1,Ice Punch,Ice,100,100,75,15,0,,,Attack,Defense,The target is punched with an icy fist. This has a 10% chance to leave the target frozen.,The target is punched with an icy fist. This may also leave the target frozen.,"One other Pokémon on the field, selected by the trainer.",Ice Punch,Beauty,10,6
9,1,Thunder Punch,Electric,100,100,75,15,0,,,Attack,Defense,The target is punched with an electrified fist. This may also leave the target with paralysis.,The target is punched with an electrified fist. This may also leave the target with paralysis.,"One other Pokémon on the field, selected by the trainer.",Thunder Punch,Cool,10,7
10,1,Scratch,Normal,100,100,40,35,0,,,Attack,Defense,"Hard, pointed, sharp claws rake the target to inflict damage.",Hard pointed sharp claws rake the target to inflict damage.,"One other Pokémon on the field, selected by the trainer.",Scratch,Tough,,1
11,1,Vise Grip,Normal,100,100,55,30,0,,,Attack,Defense,The target is gripped and squeezed from both sides to inflict damage. The target becomes immobilized.,The target is gripped and squeezed from both sides to inflict damage.,"One other Pokémon on the field, selected by the trainer.",Vice Grip,Tough,,1
12,1,Guillotine,Normal,50,30,,5,0,,,Attack,Defense,"A vicious, tearing attack with big pincers. The target faints instantly if it hits.",A vicious tearing attack with big pincers. The target faints instantly if this attack hits.,"One other Pokémon on the field, selected by the trainer.",Guillotine,Cool,,39
13,1,Razor Wind,Normal,100,100,80,10,0,,,S. Attack,S. Defense,A two-turn attack. Blades of wind hit opposing Pokémon on the second turn. Critical hits land more easily.,In this two-turn attack blades of wind hit opposing Pokémon on the second turn. Critical hits land more easily.,All opposing Pokémon.,Razor Wind,Cool,,40
14,1,Swords Dance,Normal,-1,,,20,0,,,None,None,A frenetic dance to uplift the fighting spirit. This sharply raises the Attack stat.,A frenetic dance to uplift the fighting spirit. This sharply raises the user’s Attack stat.,The user.,Swords Dance,Beauty,,51
15,1,Cut,Normal,90,95,50,30,0,,,Attack,Defense,The target is cut with a scythe or claw.,The target is cut with a scythe or claw.,"One other Pokémon on the field, selected by the trainer.",Cut,Cool,,1
16,1,Gust,Flying,100,100,40,35,0,,,S. Attack,S. Defense,A gust of wind is whipped up by wings and launched at the target to inflict damage.,A gust of wind is whipped up by wings and launched at the target to inflict damage.,"One other Pokémon on the field, selected by the trainer.",Gust,Smart,,150
17,1,Wing Attack,Flying,100,100,60,35,0,,,Attack,Defense,"The target is struck with large, imposing wings spread wide to inflict damage.",The target is struck with large imposing wings spread wide to inflict damage.,"One other Pokémon on the field, selected by the trainer.",Wing Attack,Cool,,1
18,1,Whirlwind,Normal,100,,,20,-6,,,None,None,The user generates a powerful wind that blows away other Pokémon.,The target is blown away and a different Pokémon is dragged out. In the wild this ends a battle against a single Pokémon.,"One other Pokémon on the field, selected by the trainer.",Whirlwind,Smart,,29
19,1,Fly,Flying,90,95,90,15,0,,,Attack,Defense,The user soars and then strikes its target any time in the next 5 turns.,The user soars and then strikes its target on the next turn.,"One other Pokémon on the field, selected by the trainer.",Fly,Smart,,156
20,1,Bind,Normal,70,85,15,20,0,,,Attack,Defense,Things such as long bodies or tentacles are used to bind and squeeze the target for three turns.,Things such as long bodies or tentacles are used to bind and squeeze the target for four to five turns.,"One other Pokémon on the field, selected by the trainer.",Bind,Tough,100,43
21,1,Slam,Normal,80,75,80,20,0,,,Attack,Defense,"The target is slammed with a long tail, vines, or the like to inflict damage.",The target is slammed with a long tail vines or the like to inflict damage.,"One other Pokémon on the field, selected by the trainer.",Slam,Tough,,1
22,1,Vine Whip,Grass,100,100,45,25,0,,,Attack,Defense,"The target is struck with slender, whiplike vines to inflict damage.",The target is struck with slender whiplike vines to inflict damage.,"One other Pokémon on the field, selected by the trainer.",Vine Whip,Cool,,1
23,1,Stomp,Normal,100,100,65,20,0,,,Attack,Defense,The target is stomped with a big foot. This may also make the target flinch.,The target is stomped with a big foot. This may also make the target flinch.,"One other Pokémon on the field, selected by the trainer.",Stomp,Tough,30,151
24,1,Double Kick,Fighting,75,100,30,30,0,,,Attack,Defense,The target is quickly kicked twice in succession using both feet.,The target is quickly kicked twice in succession using both feet.,"One other Pokémon on the field, selected by the trainer.",Double Kick,Cool,,45
25,1,Mega Kick,Normal,70,75,120,5,0,,,Attack,Defense,The target is attacked by a kick launched with muscle-packed power.,The target is attacked by a kick launched with muscle-packed power.,"One other Pokémon on the field, selected by the trainer.",Mega Kick,Cool,,1
26,1,Jump Kick,Fighting,85,95,100,10,0,,,Attack,Defense,"The user jumps up high, then strikes with a kick. If the kick misses, the user hurts itself.",The user jumps up high then strikes with a kick. If the kick misses the user hurts itself.,"One other Pokémon on the field, selected by the trainer.",Jump Kick,Cool,,46
27,1,Rolling Kick,Fighting,75,85,60,15,0,,,Attack,Defense,"The user lashes out with a quick, spinning kick. This may also make the target flinch.",The user lashes out with a quick spinning kick. This may also make the target flinch.,"One other Pokémon on the field, selected by the trainer.",Rolling Kick,Cool,30,32
28,1,Sand Attack,Ground,100,100,,15,0,,,None,None,"Sand is hurled in the target's face, reducing the target's Accuracy.",Sand is hurled in the target’s face reducing the target’s accuracy.,"One other Pokémon on the field, selected by the trainer.",Sand Attack,Cute,,24
29,1,Headbutt,Normal,100,100,70,15,0,,,Attack,Defense,The user sticks out its head and attacks by charging straight into the target. This has a 30% to make the target flinch.,The user sticks out its head and attacks by charging straight into the target. This may also make the target flinch.,"One other Pokémon on the field, selected by the trainer.",Headbutt,Tough,30,32
30,1,Horn Attack,Normal,85,100,65,25,0,,,Attack,Defense,The target is jabbed with a sharply pointed horn to inflict damage. Critical hits land more easily.,The target is jabbed with a sharply pointed horn to inflict damage.,"One other Pokémon on the field, selected by the trainer.",Horn Attack,Cool,,1
31,1,Fury Attack,Normal,80,85,15,20,0,,,Attack,Defense,The target is jabbed repeatedly with a horn or beak five times in a row.,The target is jabbed repeatedly with a horn or beak two to five times in a row.,"One other Pokémon on the field, selected by the trainer.",Fury Attack,Cool,,30
32,1,Horn Drill,Normal,50,30,,5,0,,,Attack,Defense,The user stabs the target with a horn that rotates like a drill. The target faints instantly if it hits. Fails if the target is a higher level.,The user stabs the target with a horn that rotates like a drill. The target faints instantly if this attack hits.,"One other Pokémon on the field, selected by the trainer.",Horn Drill,Cool,,39
33,1,Tackle,Normal,100,100,40,35,0,,,Attack,Defense,A physical attack in which the user charges and slams into the target with its whole body.,A physical attack in which the user charges and slams into the target with its whole body.,"One other Pokémon on the field, selected by the trainer.",Tackle,Tough,,1
34,1,Body Slam,Normal,100,100,85,15,0,,,Attack,Defense,The user drops onto the target with its full body weight. This may also leave the target with paralysis.,The user drops onto the target with its full body weight. This may also leave the target with paralysis.,"One other Pokémon on the field, selected by the trainer.",Body Slam,Tough,30,7
35,1,Wrap,Normal,85,90,15,20,0,,,Attack,Defense,A long body or vines are used to wrap and squeeze the target for three turns.,A long body vines or the like are used to wrap and  squeeze the target for four to five turns.,"One other Pokémon on the field, selected by the trainer.",Wrap,Tough,100,43
36,1,Take Down,Normal,80,85,90,20,0,,,Attack,Defense,"A reckless, full-body charge attack for slamming into the target. This also damages the user a little.",A reckless full-body charge attack for slamming into the target. This also damages the user a little.,"One other Pokémon on the field, selected by the trainer.",Take Down,Tough,,49
37,1,Thrash,Normal,100,100,120,10,0,,,Attack,Defense,The user rampages and attacks for three turns. The user then becomes confused.,The user rampages and attacks for two to three turns. The user then becomes confused.,"One opposing Pokémon, selected at random.",Thrash,Tough,,28
38,1,Double Edge,Normal,100,100,120,15,0,,,Attack,Defense,"A reckless, life-risking tackle. This also gives the user 33% recoil damage.",A reckless life-risking tackle. This also damages the user quite a lot.,"One other Pokémon on the field, selected by the trainer.",Double-Edge,Tough,,199
39,1,Tail Whip,Normal,100,100,,30,0,,,None,None,"The user wags its tail cutely, making opposing Pokémon less wary and lowering their Defense stat.",The user wags its tail cutely making opposing Pokémon less wary and lowering their Defense stat.,All opposing Pokémon.,Tail Whip,Cute,,20
40,1,Poison Sting,Poison,100,100,15,35,0,,,Attack,Defense,The user stabs the target with a poisonous stinger. This may also poison the target.,The user stabs the target with a poisonous stinger. This may also poison the target.,"One other Pokémon on the field, selected by the trainer.",Poison Sting,Smart,30,3
41,1,Twineedle,Bug,100,100,25,20,0,,,Attack,Defense,The user damages the target twice in succession by jabbing it with two spikes. This may also poison the target.,The user damages the target twice in succession by jabbing it with two spikes. This may also poison the target.,"One other Pokémon on the field, selected by the trainer.",Twineedle,Cool,20,78
42,1,Pin Missile,Bug,50,95,25,20,0,,,Attack,Defense,Sharp spikes are shot at the target in rapid succession. They hit four times in a row.,Sharp spikes are shot at the target in rapid succession. They hit two to five times in a row.,"One other Pokémon on the field, selected by the trainer.",Pin Missile,Cool,,30
43,1,Leer,Normal,100,100,,30,0,,,None,None,The user gives opposing Pokémon an intimidating leer that lowers the Defense stat.,The user gives opposing Pokémon an intimidating leer that lowers the Defense stat.,All opposing Pokémon.,Leer,Cool,100,20
44,1,Bite,Dark,100,100,60,25,0,,,Attack,Defense,The target is bitten with viciously sharp fangs. This has a 30% chance to make the target flinch.,The target is bitten with viciously sharp fangs. This may also make the target flinch.,"One other Pokémon on the field, selected by the trainer.",Bite,Tough,30,32
45,1,Growl,Normal,100,100,,40,0,,,None,None,"The user growls in an endearing way, making opposing Pokémon less wary. This lowers their Attack stats.",The user growls in an endearing way making opposing Pokémon less wary. This lowers their Attack stat.,All opposing Pokémon.,Growl,Cute,,19
46,1,Roar,Normal,100,,,20,-6,,,None,None,The user makes a terrifying roar that blows back opposing Pokémon.,The target is scared off and a different Pokémon is dragged out. In the wild this ends a battle against a single Pokémon.,"One other Pokémon on the field, selected by the trainer.",Roar,Cool,,29
47,1,Sing,Normal,85,55,,15,0,,,None,None,A soothing lullaby is sung in a calming voice that puts the target into a deep slumber.,A soothing lullaby is sung in a calming voice that puts the target into a deep slumber.,"One other Pokémon on the field, selected by the trainer.",Sing,Cute,,2
48,1,Supersonic,Normal,50,55,,20,0,,,None,None,The user generates odd sound waves from its body that confuse the target.,The user generates odd sound waves from its body that confuse the target.,"One other Pokémon on the field, selected by the trainer.",Supersonic,Smart,,50
49,1,Sonic Boom,Normal,100,90,,20,0,,,S. Attack,S. Defense,The target is hit with a destructive shock wave that always inflicts 1/4 of the target's max HP.,The target is hit with a destructive shock wave that always inflicts 20 HP damage.,"One other Pokémon on the field, selected by the trainer.",Sonic Boom,Cool,,131
50,1,Disable,Normal,100,100,,20,0,,,None,None,This move prevents the target from using the move it last used.,For four turns this move prevents the target from using the move it last used.,"One other Pokémon on the field, selected by the trainer.",Disable,Smart,,87
51,1,Acid,Poison,100,100,40,30,0,,,S. Attack,S. Defense,The opposing Pokémon are attacked with a spray of harsh acid. This may also lower their Sp. Def stats.,The opposing Pokémon are attacked with a spray of harsh acid. This may also lower their Sp. Def stat.,All opposing Pokémon.,Acid,Smart,10,73
52,1,Ember,Fire,100,100,40,25,0,,,S. Attack,S. Defense,The target is attacked with small flames. This may also leave the target with a burn.,The target is attacked with small flames. This may also leave the target with a burn.,"One other Pokémon on the field, selected by the trainer.",Ember,Beauty,10,5
53,1,Flamethrower,Fire,100,100,90,15,0,,,S. Attack,S. Defense,The target is scorched with an intense blast of fire. This may also leave the target with a burn.,The target is scorched with an intense blast of fire. This may also leave the target with a burn.,"One other Pokémon on the field, selected by the trainer.",Flamethrower,Beauty,10,5
54,1,Mist,Ice,-1,,,30,0,,,None,None,The user cloaks itself and its allies in a white mist that prevents any of their stats from being lowered for ten turns.,The user cloaks itself and its allies in a white mist that prevents any of their stats from being lowered for five turns.,The user's side of the field.  Affects the user and its ally (if any).,Mist,Beauty,,47
55,1,Water Gun,Water,100,100,40,25,0,,,S. Attack,S. Defense,The target is blasted with a forceful shot of water.,The target is blasted with a forceful shot of water.,"One other Pokémon on the field, selected by the trainer.",Water Gun,Cute,,1
56,1,Hydro Pump,Water,75,80,110,5,0,,,S. Attack,S. Defense,The target is blasted by a huge volume of water launched under great pressure.,The target is blasted by a huge volume of water launched under great pressure.,"One other Pokémon on the field, selected by the trainer.",Hydro Pump,Beauty,,1
57,1,Surf,Water,100,100,90,15,0,,,S. Attack,S. Defense,The user attacks everything around it by swamping its surroundings with a giant wave. Diving foes are hit with double damage.,The user attacks everything around it by swamping its surroundings with a giant wave.,Every other Pokémon on the field.,Surf,Beauty,,258
58,1,Ice Beam,Ice,100,100,90,10,0,,,S. Attack,S. Defense,The target is struck with an icy-cold beam of energy. This has a 10% chance to leave the target frozen.,The target is struck with an icy-cold beam of energy. This may also leave the target frozen.,"One other Pokémon on the field, selected by the trainer.",Ice Beam,Beauty,10,6
59,1,Blizzard,Ice,70,70,110,5,0,,,S. Attack,S. Defense,A howling blizzard is summoned to strike opposing Pokémon. This has a 10% chance to leave the opposing Pokémon frozen. It never misses in Hail.,A howling blizzard is summoned to strike opposing Pokémon. This may also leave the opposing Pokémon frozen.,All opposing Pokémon.,Blizzard,Beauty,10,261
60,1,Psybeam,Psychic,100,100,65,20,0,,,S. Attack,S. Defense,The target is attacked with a peculiar ray. This may also leave the target confused.,The target is attacked with a peculiar ray. This may also leave the target confused.,"One other Pokémon on the field, selected by the trainer.",Psybeam,Beauty,10,77
61,1,Bubble Beam,Water,100,100,65,20,0,,,S. Attack,S. Defense,A spray of bubbles is forcefully ejected at the target. This may also lower its Movement Speed.,A spray of bubbles is forcefully ejected at the target. This may also lower its Speed stat.,"One other Pokémon on the field, selected by the trainer.",Bubble Beam,Beauty,10,71
62,1,Aurora Beam,Ice,100,100,65,20,0,,,S. Attack,S. Defense,The target is hit with a rainbow-colored beam. This may also lower the target's Attack stat.,The target is hit with a rainbow-colored beam. This may also lower the target’s Attack stat.,"One other Pokémon on the field, selected by the trainer.",Aurora Beam,Beauty,10,69
63,1,Hyper Beam,Normal,90,90,150,5,0,,1,S. Attack,S. Defense,The user attacks with a destructive beam. The user can't move on the next three turns.,The target is attacked with a powerful beam. The user can’t move on the next turn.,"One other Pokémon on the field, selected by the trainer.",Hyper Beam,Cool,,81
64,1,Peck,Flying,100,100,35,35,0,,,Attack,Defense,The target is jabbed with a sharply pointed beak or horn.,The target is jabbed with a sharply pointed beak or horn.,"One other Pokémon on the field, selected by the trainer.",Peck,Cool,,1
65,1,Drill Peck,Flying,100,100,80,20,0,,,Attack,Defense,A corkscrewing attack with a sharp beak acting as a drill.,A corkscrewing attack with a sharp beak acting as a drill.,"One other Pokémon on the field, selected by the trainer.",Drill Peck,Cool,,1
66,1,Submission,Fighting,75,80,80,20,0,,,Attack,Defense,The user grabs the target and recklessly dives for the ground. This also damages the user a little.,The user grabs the target and recklessly dives for the ground. This also damages the user a little.,"One other Pokémon on the field, selected by the trainer.",Submission,Cool,,49
67,1,Low Kick,Fighting,100,100,,20,0,,,Attack,Weight,"A powerful low kick that makes the target fall over. The heavier the target, the greater the move's power.",A powerful low kick that makes the target fall over. The heavier the target the greater the move’s power.,"One other Pokémon on the field, selected by the trainer.",Low Kick,Tough,,197
68,1,Counter,Fighting,-1,100,,20,-5,,,Attack,Defense,"A retaliation move that counters any physical attack, inflicting double the damage taken.",A retaliation move that counters any physical attack inflicting double the damage taken.,One specific move.  How this move is chosen depends upon on the move being used.,Counter,Tough,,90
69,1,Seismic Toss,Fighting,100,100,,20,0,,,Attack,Defense,The target is thrown using the power of gravity. It inflicts damage equal to the user's level.,The target is thrown using the power of gravity. It inflicts damage equal to the user’s level.,"One other Pokémon on the field, selected by the trainer.",Seismic Toss,Tough,,88
70,1,Strength,Normal,100,100,80,15,0,,,Attack,Defense,"The target is slugged with a punch thrown at maximum power, pushing them back.",The target is slugged with a punch thrown at maximum power.,"One other Pokémon on the field, selected by the trainer.",Strength,Tough,,1
71,1,Absorb,Grass,100,100,20,25,0,,,S. Attack,S. Defense,A nutrient-draining attack. The user’s HP is restored by half the damage taken by the target.,A nutrient-draining attack. The user’s HP is restored by half the damage taken by the target.,"One other Pokémon on the field, selected by the trainer.",Absorb,Smart,,4
72,1,Mega Drain,Grass,100,100,40,15,0,,,S. Attack,S. Defense,A nutrient-draining attack. The user's HP is restored by half the damage taken by the target.,A nutrient-draining attack. The user’s HP is restored by half the damage taken by the target.,"One other Pokémon on the field, selected by the trainer.",Mega Drain,Smart,,4
73,1,Leech Seed,Grass,85,90,,10,0,,,None,None,A seed is planted on the target. It steals some HP from the target every turn.,A seed is planted on the target. It steals some HP from the target every turn.,"One other Pokémon on the field, selected by the trainer.",Leech Seed,Smart,,85
74,1,Growth,Normal,-1,,,20,0,,,None,None,"The user's body grows all at once, raising the Attack and Sp. Atk stats. The effect is doubled under Sunny Day.",The user’s body grows all at once raising the Attack and Sp. Atk stats.,The user.,Growth,Beauty,,317
75,1,Razor Leaf,Grass,100,95,55,25,0,,,Attack,Defense,Sharp-edged leaves are launched to slash at the opposing Pokémon. Critical hits land more easily.,Sharp-edged leaves are launched to slash at the opposing Pokémon. Critical hits land more easily.,All opposing Pokémon.,Razor Leaf,Cool,,44
76,1,Solar Beam,Grass,100,100,120,10,0,1,,S. Attack,S. Defense,"A two-turn attack. The user gathers light, then blasts a bundled beam on the next turn. In sunlight, the charge is skipped and it never misses.",In this two-turn attack the user gathers light then blasts a bundled beam on the next turn.,"One other Pokémon on the field, selected by the trainer.",Solar Beam,Cool,,152
77,1,Poison Powder,Poison,50,75,,35,0,,,None,None,The user scatters a cloud of poisonous dust that poisons the target.,The user scatters a cloud of poisonous dust that poisons the target.,"One other Pokémon on the field, selected by the trainer.",Poison Powder,Smart,,67
78,1,Stun Spore,Grass,50,75,,30,0,,,None,None,The user scatters a cloud of numbing powder that paralyzes the target.,The user scatters a cloud of numbing powder that paralyzes the target.,"One other Pokémon on the field, selected by the trainer.",Stun Spore,Smart,,68
79,1,Sleep Powder,Grass,50,75,,15,0,,,None,None,The user scatters a big cloud of sleep-inducing dust around the target.,The user scatters a big cloud of sleep-inducing dust around the target.,"One other Pokémon on the field, selected by the trainer.",Sleep Powder,Smart,,2
80,1,Petal Dance,Grass,100,100,120,10,0,,,S. Attack,S. Defense,The user attacks the target by scattering petals for three turns. The user then becomes confused.,The user attacks the target by scattering petals for two to three turns. The user then becomes confused.,"One opposing Pokémon, selected at random.",Petal Dance,Beauty,,28
81,1,String Shot,Bug,100,95,,40,0,,,None,None,The opposing Pokémon are bound with silk blown from the user's mouth that lowers Movement Speed.,The opposing Pokémon are bound with silk blown from the user’s mouth that harshly lowers the Speed stat.,All opposing Pokémon.,String Shot,Smart,,61
82,1,Dragon Rage,Dragon,100,100,,10,0,,,S. Attack,S. Defense,This attack hits the target with a shock wave of pure rage. This attack inflicts damage equal to the amount of HP the user is missing.,This attack hits the target with a shock wave of pure rage. This attack always inflicts 40 HP damage.,"One other Pokémon on the field, selected by the trainer.",Dragon Rage,Cool,,42
83,1,Fire Spin,Fire,100,85,35,15,0,,,S. Attack,S. Defense,The target becomes trapped within a fierce vortex of fire that rages for three to five turns.,The target becomes trapped within a fierce vortex of fire that rages for four to five turns.,"One other Pokémon on the field, selected by the trainer.",Fire Spin,Beauty,100,43
84,1,Thunder Shock,Electric,100,100,40,30,0,,,S. Attack,S. Defense,A jolt of electricity crashes down on the target to inflict damage. This may also leave the target with paralysis.,A jolt of electricity crashes down on the target to inflict damage. This may also leave the target with paralysis.,"One other Pokémon on the field, selected by the trainer.",Thunder Shock,Cool,10,7
